{
  "schema_version": "1.0.0",
  "source_id": "cwnu.curriculum.2026.changwon-undergraduate",
  "source_sha256": "0d800318dc367a89518f9be6be8f559092474bf00b3573e14bd37b6c44b54471",
  "verification": {
    "status": "source_verified",
    "method": "exact_transcription_and_independent_visual_audit",
    "inspected_pdf_pages": [
      262,
      263
    ],
    "note": "Approved original source; direct facts, not new human approval of graduation or elective-allocation rules. Catalogue offerings do not guarantee actual semester opening."
  },
  "courses": [
    {
      "course_id": "cwnu.cs.2026.course.cda0163",
      "course_code": "CDA0163",
      "course_name": "웹프로그래밍",
      "category": "major_elective",
      "credits": 3,
      "year": 1,
      "semester": 1,
      "offering_years": [
        1
      ],
      "offering_semesters": [
        "1"
      ],
      "offering_label": "1학년 1학기",
      "theory": 2,
      "practical": 2,
      "minor_required": false,
      "source_id": "cwnu.curriculum.2026.changwon-undergraduate",
      "source_sha256": "0d800318dc367a89518f9be6be8f559092474bf00b3573e14bd37b6c44b54471",
      "locator": "PDF p.262 (printed p.254), Ⅱ 전공 교과목 편성표, CDA0163 row",
      "fact_sha256": "8866757e287284e4c553abd5b4d6922438472f032c0982bbd445d083d2269fec"
    },
    {
      "course_id": "cwnu.cs.2026.course.cda0174",
      "course_code": "CDA0174",
      "course_name": "피지컬AI입문",
      "category": "major_elective",
      "credits": 3,
      "year": 1,
      "semester": 1,
      "offering_years": [
        1
      ],
      "offering_semesters": [
        "1"
      ],
      "offering_label": "1학년 1학기",
      "theory": 3,
      "practical": 0,
      "minor_required": false,
      "source_id": "cwnu.curriculum.2026.changwon-undergraduate",
      "source_sha256": "0d800318dc367a89518f9be6be8f559092474bf00b3573e14bd37b6c44b54471",
      "locator": "PDF p.262 (printed p.254), Ⅱ 전공 교과목 편성표, CDA0174 row",
      "fact_sha256": "4e66ca16504b2891c55ed71807115cd22977bd1a72b792b5a07eb89f8ce206ea"
    },
    {
      "course_id": "cwnu.cs.2026.course.cda0157",
      "course_code": "CDA0157",
      "course_name": "이산수학",
      "category": "major_elective",
      "credits": 3,
      "year": 1,
      "semester": 2,
      "offering_years": [
        1
      ],
      "offering_semesters": [
        "2"
      ],
      "offering_label": "1학년 2학기",
      "theory": 3,
      "practical": 0,
      "minor_required": false,
      "source_id": "cwnu.curriculum.2026.changwon-undergraduate",
      "source_sha256": "0d800318dc367a89518f9be6be8f559092474bf00b3573e14bd37b6c44b54471",
      "locator": "PDF p.262 (printed p.254), Ⅱ 전공 교과목 편성표, CDA0157 row",
      "fact_sha256": "cb961eb4160a14e2a836134a269bc53f960210c5d784c3aef24141dddf5e1c76"
    },
    {
      "course_id": "cwnu.cs.2026.course.cda0170",
      "course_code": "CDA0170",
      "course_name": "컴퓨터공학기술세미나",
      "category": "major_elective",
      "credits": 3,
      "year": 1,
      "semester": 2,
      "offering_years": [
        1
      ],
      "offering_semesters": [
        "2"
      ],
      "offering_label": "1학년 2학기",
      "theory": 3,
      "practical": 0,
      "minor_required": false,
      "source_id": "cwnu.curriculum.2026.changwon-undergraduate",
      "source_sha256": "0d800318dc367a89518f9be6be8f559092474bf00b3573e14bd37b6c44b54471",
      "locator": "PDF p.262 (printed p.254), Ⅱ 전공 교과목 편성표, CDA0170 row",
      "fact_sha256": "71981acd50373210acf4180a176217f8a1d5e4380f7a9885b435a652601b3fc3"
    },
    {
      "course_id": "cwnu.cs.2026.course.cda0008",
      "course_code": "CDA0008",
      "course_name": "자료구조",
      "category": "major_elective",
      "credits": 3,
      "year": 2,
      "semester": 1,
      "offering_years": [
        2
      ],
      "offering_semesters": [
        "1"
      ],
      "offering_label": "2학년 1학기",
      "theory": 3,
      "practical": 0,
      "minor_required": true,
      "source_id": "cwnu.curriculum.2026.changwon-undergraduate",
      "source_sha256": "0d800318dc367a89518f9be6be8f559092474bf00b3573e14bd37b6c44b54471",
      "locator": "PDF p.262 (printed p.254), Ⅱ 전공 교과목 편성표, CDA0008 row",
      "fact_sha256": "d2506a7f4d755efe9dce2096df7fd58e369dbbba915c0739d10eb724bf3fa8c4"
    },
    {
      "course_id": "cwnu.cs.2026.course.cda0010",
      "course_code": "CDA0010",
      "course_name": "논리설계",
      "category": "major_elective",
      "credits": 3,
      "year": 2,
      "semester": 1,
      "offering_years": [
        2
      ],
      "offering_semesters": [
        "1"
      ],
      "offering_label": "2학년 1학기",
      "theory": 3,
      "practical": 0,
      "minor_required": false,
      "source_id": "cwnu.curriculum.2026.changwon-undergraduate",
      "source_sha256": "0d800318dc367a89518f9be6be8f559092474bf00b3573e14bd37b6c44b54471",
      "locator": "PDF p.262 (printed p.254), Ⅱ 전공 교과목 편성표, CDA0010 row",
      "fact_sha256": "fae2dbc0662c31a86db6e4ce88ddd65cc169f2d1adb5bdaf6d21ff66ae200b47"
    },
    {
      "course_id": "cwnu.cs.2026.course.cda0014",
      "course_code": "CDA0014",
      "course_name": "컴퓨터그래픽스",
      "category": "major_elective",
      "credits": 3,
      "year": 2,
      "semester": 1,
      "offering_years": [
        2
      ],
      "offering_semesters": [
        "1"
      ],
      "offering_label": "2학년 1학기",
      "theory": 3,
      "practical": 0,
      "minor_required": false,
      "source_id": "cwnu.curriculum.2026.changwon-undergraduate",
      "source_sha256": "0d800318dc367a89518f9be6be8f559092474bf00b3573e14bd37b6c44b54471",
      "locator": "PDF p.262 (printed p.254), Ⅱ 전공 교과목 편성표, CDA0014 row",
      "fact_sha256": "b021901122f6bb4d0425011f8be5eb4b2421d31fabe5a60c3f376d21f4282965"
    },
    {
      "course_id": "cwnu.cs.2026.course.cda0143",
      "course_code": "CDA0143",
      "course_name": "고급자료구조",
      "category": "major_required",
      "credits": 3,
      "year": 2,
      "semester": 2,
      "offering_years": [
        2
      ],
      "offering_semesters": [
        "2"
      ],
      "offering_label": "2학년 2학기",
      "theory": 3,
      "practical": 0,
      "minor_required": false,
      "source_id": "cwnu.curriculum.2026.changwon-undergraduate",
      "source_sha256": "0d800318dc367a89518f9be6be8f559092474bf00b3573e14bd37b6c44b54471",
      "locator": "PDF p.262 (printed p.254), Ⅱ 전공 교과목 편성표, CDA0143 row",
      "fact_sha256": "ddbc31f1cdb096e2b77fb1a1246551d921eefbf230e9c40626a589de58d9596b"
    },
    {
      "course_id": "cwnu.cs.2026.course.cda0006",
      "course_code": "CDA0006",
      "course_name": "시스템프로그래밍",
      "category": "major_elective",
      "credits": 3,
      "year": 2,
      "semester": 2,
      "offering_years": [
        2
      ],
      "offering_semesters": [
        "2"
      ],
      "offering_label": "2학년 2학기",
      "theory": 3,
      "practical": 0,
      "minor_required": false,
      "source_id": "cwnu.curriculum.2026.changwon-undergraduate",
      "source_sha256": "0d800318dc367a89518f9be6be8f559092474bf00b3573e14bd37b6c44b54471",
      "locator": "PDF p.262 (printed p.254), Ⅱ 전공 교과목 편성표, CDA0006 row",
      "fact_sha256": "c5755f2482dda0e2ed4aea7e6ce976d4b50e5fbfd48c60e53b57043d069ede25"
    },
    {
      "course_id": "cwnu.cs.2026.course.cda0013",
      "course_code": "CDA0013",
      "course_name": "프로그래밍언어론",
      "category": "major_elective",
      "credits": 3,
      "year": 2,
      "semester": 2,
      "offering_years": [
        2
      ],
      "offering_semesters": [
        "2"
      ],
      "offering_label": "2학년 2학기",
      "theory": 3,
      "practical": 0,
      "minor_required": false,
      "source_id": "cwnu.curriculum.2026.changwon-undergraduate",
      "source_sha256": "0d800318dc367a89518f9be6be8f559092474bf00b3573e14bd37b6c44b54471",
      "locator": "PDF p.262 (printed p.254), Ⅱ 전공 교과목 편성표, CDA0013 row",
      "fact_sha256": "b0179a2ec73ab437f12c8f68ce13de8801a761535ba7ef52945d6de0dbddb99d"
    },
    {
      "course_id": "cwnu.cs.2026.course.cda0125",
      "course_code": "CDA0125",
      "course_name": "모바일프로그래밍",
      "category": "major_elective",
      "credits": 3,
      "year": 2,
      "semester": 2,
      "offering_years": [
        2
      ],
      "offering_semesters": [
        "2"
      ],
      "offering_label": "2학년 2학기",
      "theory": 2,
      "practical": 2,
      "minor_required": false,
      "source_id": "cwnu.curriculum.2026.changwon-undergraduate",
      "source_sha256": "0d800318dc367a89518f9be6be8f559092474bf00b3573e14bd37b6c44b54471",
      "locator": "PDF p.262 (printed p.254), Ⅱ 전공 교과목 편성표, CDA0125 row",
      "fact_sha256": "6f5ee01f05aa23be74c0e0d9948696972b56c513a1e22128c071d8a443a6d822"
    },
    {
      "course_id": "cwnu.cs.2026.course.cda0176",
      "course_code": "CDA0176",
      "course_name": "임베디드시스템",
      "category": "major_elective",
      "credits": 3,
      "year": 2,
      "semester": 2,
      "offering_years": [
        2
      ],
      "offering_semesters": [
        "2"
      ],
      "offering_label": "2학년 2학기",
      "theory": 3,
      "practical": 0,
      "minor_required": false,
      "source_id": "cwnu.curriculum.2026.changwon-undergraduate",
      "source_sha256": "0d800318dc367a89518f9be6be8f559092474bf00b3573e14bd37b6c44b54471",
      "locator": "PDF p.262 (printed p.254), Ⅱ 전공 교과목 편성표, CDA0176 row",
      "fact_sha256": "f11379de5c93fefd4206bb4750346704eb0612566954cc2c44e6b1ba7ee10a18"
    },
    {
      "course_id": "cwnu.cs.2026.course.cda0155",
      "course_code": "CDA0155",
      "course_name": "객체지향프로그래밍",
      "category": "major_elective",
      "credits": 3,
      "year": 2,
      "semester": null,
      "offering_years": [
        2
      ],
      "offering_semesters": [
        "1",
        "2"
      ],
      "offering_label": "2학년 1·2학기",
      "theory": 2,
      "practical": 2,
      "minor_required": false,
      "source_id": "cwnu.curriculum.2026.changwon-undergraduate",